Motocicleta,Bicicleta - Bicicleta plus,Automóvil
Ann peya market antofagasta norte,Ann peya market antofagasta norte,Ann antofagasta norte +$200
Ann la chimba,Ann la chimba,Ann antofagasta norte express
Ann antofagasta norte +$200,Ann antofagasta norte +$200,Ans peya market antofagasta sur
Ann centro comercial pacífico,Ann centro comercial pacífico,Ans mall plaza antofagasta
Ann antofagasta norte express,Ann antofagasta norte express,Ans enjoy antofagasta
Ans peya market antofagasta sur,Ans mall plaza antofagasta,Ans antofagasta sur +$200
Ans mall plaza antofagasta,Ans antofagasta sur express,Ans antofagasta sur express
Ans antofagasta sur express,Ans enjoy antofagasta,Ann centro comercial pacífico
Ans enjoy antofagasta,Ans antofagasta sur +$200,Ann la chimba
Ans antofagasta sur +$200,Ans peya market antofagasta sur,Ann peya market antofagasta norte