Motocicleta,Bicicleta - Bicicleta plus,Automóvil
Lag los angeles +$200,Lag los angeles +$200,Mel espacio urbano melipilla
Lag los angeles express,Lag peya market los angeles,Lag los angeles +$200
Lag peya market los angeles,Lag los angeles express,Lag mall plaza los angeles
Lag mall plaza los angeles bici-moto,Lag mall plaza los angeles,Lag peya market los angeles
Lag mall plaza los angeles,Mel espacio urbano melipilla,Lag los angeles express
Mel espacio urbano melipilla,Lag mall plaza los angeles bici-moto,
